{
  "task_id": "GRAMMAR-AUTONOMOUS-P3A-STABILIZATION-TO-P3B-CHROMIUM-PERSONAL-USE-R1",
  "owner_decision": "Owner mission prompt 2026-09-25, explicit local autonomous development authorization",
  "objective": "P3-A safety baseline and first Chromium proactive personal-use adapter",
  "base_branch": "main",
  "base_subject": "fix: align fresh-chat expectations with uploaded source snapshot",
  "base_head": "4e833988ed27086dd6d4acb78d39fc3e9c98c707",
  "base_tree": "d74a2ae8a75c0bf7dcbfae6eafd730ba00e0bc79",
  "authorized_paths": [
    "src-tauri/src/codex_binary.rs",
    "src-tauri/src/codex_client.rs",
    "src-tauri/src/process_job.rs",
    "src-tauri/src/provider/antigravity.rs",
    "src-tauri/src/provider/claude.rs",
    "src-tauri/src/provider/cli.rs",
    "src-tauri/src/provider/manager.rs",
    "src-tauri/src/runtime_isolation.rs",
    "src-tauri/tests/runtime_mission/**",
    "src-tauri/src/apply_safety.rs",
    "src-tauri/src/capture_session.rs",
    "src-tauri/src/clipboard.rs",
    "src-tauri/src/windows_target.rs",
    "src/App.tsx",
    "src/instantSelectionRuntime.ts",
    "src-tauri/tests/apply_mission/**",
    "scripts/test-mission-draft.mjs",
    "src/captureContract.ts",
    "src-tauri/src/p0_02_contract_tests.rs",
    "scripts/test-p3-03-instant-runtime-state.mjs",
    "adapters/chromium/tests/worker.test.mjs",
    "src-tauri/Cargo.toml",
    "src-tauri/src/p0_02_windows_live_tests.rs",
    "src-tauri/src/p1_03_contract_tests.rs",
    "docs/**",
    "control/**",
    "AGENTS.md",
    "CLAUDE.md",
    ".cursor/rules/grammar-project.mdc",
    "scripts/validate_governance.py",
    "adapters/chromium/extension/**",
    "adapters/chromium/README.md",
    "src-tauri/src/main.rs",
    "scripts/mission/verify.mjs",
    "scripts/mission/package.ps1",
    "adapters/chromium/tests/core.test.mjs",
    "adapters/chromium/tests/browser.test.mjs",
    "src-tauri/src/bin/grammar-chromium-host.rs",
    "adapters/chromium/host/**",
    "scripts/build-daily-use-bundle.ps1",
    "scripts/mission/test-provenance.ps1",
    "scripts/mission/build-receipt.ps1",
    "scripts/project_source.py",
    "scripts/test_project_source.py"
  ],
  "forbidden_paths": [],
  "required_reads": [
    "docs/control/MULTI_AGENT_CONTRACT.md",
    "control/state.json",
    "docs/control/PRODUCT_CHARTER.md",
    "docs/control/CURRENT_AUDIT.md",
    "docs/control/ROADMAP.md",
    "docs/control/ACCEPTANCE_MATRIX.md"
  ],
  "preconditions": [
    "Measured canonical main; preserve failed worktrees and unrelated files"
  ],
  "invariants": [
    "Explicit mutation; exact target/revision/source; sensitive deny; opt-in before read; bounded memory; no credentials or user data; selected Provider only"
  ],
  "acceptance_tests": [
    "Production regression, negative lifecycle/privacy tests, synthetic native editor reread, locked build and artifact receipt"
  ],
  "stop_conditions": [
    "Mission expansion or external actions requiring Owner authority"
  ],
  "automatic_continuation": false,
  "packet_status": "AUTHORIZED",
  "live_tests": [
    "Synthetic task-owned Windows processes and editor; real Provider NOT_RUN without separate authority"
  ],
  "privacy_tests": [
    "No secure field reads; revoke clears caches; no hover inference; no raw text persistence"
  ],
  "evidence_root": "D:/dev/grammar-evidence/grammar-autonomous-r1",
  "commit_policy": "Small reviewed local commits",
  "integration_policy": "Reviewed safe local fast-forward; preserve unrelated work",
  "project_source_policy": "Exact 12 canonical export at material milestone; manual UI application Owner only",
  "next_gate_policy": "CONTINUE_WITHIN_MISSION",
  "mission_id": "GRAMMAR-AUTONOMOUS-P3A-STABILIZATION-TO-P3B-CHROMIUM-PERSONAL-USE-R1",
  "internal_continuation": true,
  "scope_expansion": false,
  "remote_publication": false
}
